{
  "command": "uv",
  "description": "Tool definition for uv (auto-generated skeleton)",
  "usage": "uv [options] [arguments]",
  "options": [],
  "arguments": [],
  "metadata": {
    "name": "uv",
    "version": null,
    "language": "unknown",
    "categories": [],
    "tags": [
      "skeleton"
    ],
    "url": "",
    "other": {},
    "tool_name": "uv",
    "command_name": "venv",
    "ground_truth_crc": "0x00000000"
  },
  "subcommand": "venv"
}
