{
  "command": "autopep8",
  "subcommand": null,
  "description": "Automatically formats Python code to conform to the PEP 8 style guide.",
  "usage": "autopep8 [-h] [--version] [-v] [-d] [-i] [--global-config filename] [--ignore-local-config] [-r] [-j n] [-p n] [-a] [--experimental] [--exclude globs] [--list-fixes] [--ignore errors] [--select errors] [--max-line-length n] [--line-range line line] [--hang-closing] [--exit-code] [files ...]",
  "arguments": [
    {
      "name": "files",
      "description": "files to format or '-' for standard in",
      "required": false,
      "nargs": "*"
    }
  ],
  "options": [
    {
      "name": "--help",
      "aliases": [
        "-h"
      ],
      "description": "show this help message and exit",
      "argument": null,
      "required": false,
      "allow_multiple": false
    },
    {
      "name": "--version",
      "aliases": [],
      "description": "show program's version number and exit",
      "argument": null,
      "required": false,
      "allow_multiple": false
    },
    {
      "name": "--verbose",
      "aliases": [
        "-v"
      ],
      "description": "print verbose messages; multiple -v result in more verbose messages",
      "argument": null,
      "required": false,
      "allow_multiple": true
    },
    {
      "name": "--diff",
      "aliases": [
        "-d"
      ],
      "description": "print the diff for the fixed source",
      "argument": null,
      "required": false,
      "allow_multiple": false
    },
    {
      "name": "--in-place",
      "aliases": [
        "-i"
      ],
      "description": "make changes to files in place",
      "argument": null,
      "required": false,
      "allow_multiple": false
    },
    {
      "name": "--global-config",
      "aliases": [],
      "argument": "filename",
      "description": "path to a global pep8 config file; if this file does not exist then this is ignored (default: /home/trahloc/.config/pep8)",
      "required": false,
      "allow_multiple": false
    },
    {
      "name": "--ignore-local-config",
      "aliases": [],
      "description": "don't look for and apply local config files; if not passed, defaults are updated with any config files in the project's root directory",
      "argument": null,
      "required": false,
      "allow_multiple": false
    },
    {
      "name": "--recursive",
      "aliases": [
        "-r"
      ],
      "description": "run recursively over directories; must be used with --in-place or --diff",
      "argument": null,
      "required": false,
      "allow_multiple": false
    },
    {
      "name": "--jobs",
      "aliases": [
        "-j"
      ],
      "argument": "n",
      "description": "number of parallel jobs; match CPU count if value is less than 1",
      "required": false,
      "allow_multiple": false
    },
    {
      "name": "--pep8-passes",
      "aliases": [
        "-p"
      ],
      "argument": "n",
      "description": "maximum number of additional pep8 passes (default: infinite)",
      "required": false,
      "allow_multiple": false
    },
    {
      "name": "--aggressive",
      "aliases": [
        "-a"
      ],
      "description": "enable non-whitespace changes; multiple -a result in more aggressive changes",
      "argument": null,
      "required": false,
      "allow_multiple": true
    },
    {
      "name": "--experimental",
      "aliases": [],
      "description": "enable experimental fixes",
      "argument": null,
      "required": false,
      "allow_multiple": false
    },
    {
      "name": "--exclude",
      "aliases": [],
      "argument": "globs",
      "description": "exclude file/directory names that match these comma-separated globs",
      "required": false,
      "allow_multiple": false
    },
    {
      "name": "--list-fixes",
      "aliases": [],
      "description": "list codes for fixes; used by --ignore and --select",
      "argument": null,
      "required": false,
      "allow_multiple": false
    },
    {
      "name": "--ignore",
      "aliases": [],
      "argument": "errors",
      "description": "do not fix these errors/warnings (default: E226,E24,W50,W690)",
      "required": false,
      "allow_multiple": false
    },
    {
      "name": "--select",
      "aliases": [],
      "argument": "errors",
      "description": "fix only these errors/warnings (e.g. E4,W)",
      "required": false,
      "allow_multiple": false
    },
    {
      "name": "--max-line-length",
      "aliases": [],
      "argument": "n",
      "description": "set maximum allowed line length (default: 79)",
      "required": false,
      "allow_multiple": false
    },
    {
      "name": "--line-range",
      "aliases": [
        "--range"
      ],
      "argument": "line line",
      "description": "only fix errors found within this inclusive range of line numbers (e.g. 1 99); line numbers are indexed at 1",
      "required": false,
      "nargs": 2,
      "allow_multiple": false
    },
    {
      "name": "--hang-closing",
      "aliases": [],
      "description": "hang-closing option passed to pycodestyle",
      "argument": null,
      "required": false,
      "allow_multiple": false
    },
    {
      "name": "--exit-code",
      "aliases": [],
      "description": "change to behavior of exit code. default behavior of return value, 0 is no differences, 1 is error exit. return 2 when add this option. 2 is exists differences.",
      "argument": null,
      "required": false,
      "allow_multiple": false
    }
  ],
  "subcommands_detail": {},
  "metadata": {
    "ground_truth_crc": "0x1FBFC363",
    "tool_name": "autopep8",
    "command_name": "autopep8"
  }
}