{
  "description": "(Placeholder description for zeroth-law_restore-git-hooks)",
  "usage": "zeroth-law restore-git-hooks [OPTIONS]",
  "options": [],
  "arguments": [],
  "metadata": {
    "ground_truth_crc": "0x00000000",
    "schema_version": "1.0",
    "tool_name": "zeroth-law",
    "command_name": "restore-git-hooks"
  },
  "command": "zeroth-law",
  "subcommand": "restore-git-hooks"
}