{
  "command": "coverage",
  "subcommand": "combine",
  "description": "Combine data from multiple coverage files. The combined results are written to a single file representing the union of the data. The positional arguments are data files or directories containing data files. If no paths are provided, data files in the default data file's directory are combined.",
  "usage": "coverage combine [options] <path1> <path2> ... <pathN>",
  "options": [],
  "arguments": [
    {
      "name": "path",
      "description": "Data files or directories containing data files to combine. If none provided, data files in the default data file's directory are combined.",
      "required": false,
      "nargs": "*"
    }
  ],
  "metadata": {
    "ground_truth_crc": "0x16045BD7",
    "schema_version": "1.0",
    "tool_name": "coverage",
    "command_name": "combine"
  }
}