{
  "command": "ruff",
  "subcommand": null,
  "description": "Ruff: An extremely fast Python linter and code formatter.",
  "usage": "ruff [OPTIONS] <COMMAND>",
  "arguments": [],
  "options": [
    {
      "name": "--help",
      "aliases": [
        "-h"
      ],
      "description": "Print help.",
      "argument": null,
      "required": false,
      "allow_multiple": false
    },
    {
      "name": "--version",
      "aliases": [
        "-V"
      ],
      "description": "Print version.",
      "argument": null,
      "required": false,
      "allow_multiple": false
    },
    {
      "name": "--verbose",
      "aliases": [
        "-v"
      ],
      "description": "Enable verbose logging.",
      "argument": null,
      "required": false,
      "allow_multiple": false
    },
    {
      "name": "--quiet",
      "aliases": [
        "-q"
      ],
      "description": "Print diagnostics, but nothing else.",
      "argument": null,
      "required": false,
      "allow_multiple": false
    },
    {
      "name": "--silent",
      "aliases": [
        "-s"
      ],
      "description": "Disable all logging (but still exit with status code \"1\" upon detecting diagnostics).",
      "argument": null,
      "required": false,
      "allow_multiple": false
    },
    {
      "name": "--config",
      "aliases": [],
      "description": "Either a path to a TOML configuration file (`pyproject.toml` or `ruff.toml`), or a TOML `<KEY> = <VALUE>` pair (such as you might find in a `ruff.toml` configuration file) overriding a specific configuration option. Overrides of individual settings using this option always take precedence over all configuration files, including configuration files that were also specified using `--config\".",
      "argument": "CONFIG_OPTION",
      "required": false,
      "allow_multiple": true
    },
    {
      "name": "--isolated",
      "aliases": [],
      "description": "Ignore all configuration files.",
      "argument": null,
      "required": false,
      "allow_multiple": false
    }
  ],
  "subcommands_detail": {
    "check": {
      "description": "Run Ruff on the given files or directories",
      "json_definition": "src/zeroth_law/tools/ruff/ruff_check.json"
    },
    "rule": {
      "description": "Explain a rule (or all rules)",
      "json_definition": "src/zeroth_law/tools/ruff/ruff_rule.json"
    },
    "config": {
      "description": "List or describe the available configuration options",
      "json_definition": "src/zeroth_law/tools/ruff/ruff_config.json"
    },
    "linter": {
      "description": "List all supported upstream linters",
      "json_definition": "src/zeroth_law/tools/ruff/ruff_linter.json"
    },
    "clean": {
      "description": "Clear any caches in the current directory and any subdirectories",
      "json_definition": "src/zeroth_law/tools/ruff/ruff_clean.json"
    },
    "format": {
      "description": "Run the Ruff formatter on the given files or directories",
      "json_definition": "src/zeroth_law/tools/ruff/ruff_format.json"
    },
    "server": {
      "description": "Run the language server",
      "json_definition": "src/zeroth_law/tools/ruff/ruff_server.json"
    },
    "analyze": {
      "description": "Run analysis over Python source code",
      "json_definition": "src/zeroth_law/tools/ruff/ruff_analyze.json"
    },
    "version": {
      "description": "Display Ruff's version",
      "json_definition": "src/zeroth_law/tools/ruff/ruff_version.json"
    },
    "help": {
      "description": "Print this message or the help of the given subcommand(s)",
      "json_definition": "src/zeroth_law/tools/ruff/ruff_help.json"
    }
  },
  "metadata": {
    "ground_truth_crc": "0xAE0936D1",
    "tool_name": "ruff",
    "command_name": "ruff"
  }
}